question,option1,option2,option3,option4,answer
Nếu bạn có 6 quả táo và bạn cho đi 4 quả bạn còn lại bao nhiêu quả?,2,4,6,0,1
Một chiếc tàu chạy vào một cây cầu 1 km với tốc độ 30 km/h. Mất bao lâu để tàu đi hết cây cầu?,2 phút,1 phút,5 phút,10 phút,2
Có một con cáo một con gà và một túi ngô làm thế nào để người nông dân mang tất cả chúng qua sông mà không mất gì?,Mang ngô trước,Mang gà trước,Mang cáo trước,Mang cáo và ngô cùng lúc,3
Cái gì đầy lỗ nhưng vẫn giữ nước?,Miếng bọt biển,Lưới,Khăn giấy,Thùng rác,4
Cái gì càng lấy đi nó càng lớn?,Hố sâu,Lửa,Thời gian,Ánh sáng,1
Cái gì mà bạn càng có nhiều thì lại càng nhẹ?,Lông vũ,Ánh sáng,Bạn bè,Không khí,1